,doc_id,text,country,year
217328,SDN_34_1979.txt.129,"We are particularly pleased to note the positive developments that emerged from the considerable debate conducted last year on alternative approaches, ways and means within the United Nations system, for improving the effective enjoyment of human rights.",SDN,1979
745724,TUR_49_1994.txt.608,"To the extent that it succeeds, we will have a",TUR,1994
1489677,BWA_62_2007.txt.309,consolidate the gains of the past few years and ensure,BWA,2007
293835,CRI_37_1982.txt.203,"Therefore, in order to replace bullets by votes, it was decided, at",CRI,1982
1106181,DEU_55_2000.txt.64,hitherto excluded from the advantages of globalization,DEU,2000
12134,ARG_26_1971.txt.17,"On the one hand, it is possible to assess this Organization bearing in mind the principles on which it rests under the rules that constitute it.",ARG,1971
1142995,PSE_55_2000.txt.431,of real concern for us all.,PSE,2000
1794442,LKA_67_2012.txt.158,Women who are literate also encourage,LKA,2012
1955252,UKR_70_2015.txt.18,"To mislead the world community, the Russian leadership orders its military servicemen to remove their insignias and the identification marks on military equipment.",UKR,2015
1900627,GIN_69_2014.txt.252,and the illicit trafficking in small arms and light,GIN,2014
1689765,RUS_65_2010.txt.26,through direct involvement in conflict settlement but,RUS,2010
318630,JAM_37_1982.txt.158,"General's report, and the action they might take when the Security",JAM,1982
1928349,SRB_69_2014.txt.201,minority in Kosovo and Metohija aimed at achieving,SRB,2014
180067,GRD_33_1978.txt.101,197.,GRD,1978
841445,FJI_51_1996.txt.423,preservation of their sovereignty.,FJI,1996
116805,SWE_30_1975.txt.31,These questions might usefully be discussed also in other forums.,SWE,1975
1967603,NRU_71_2016.txt.40,"However, it is far too early to celebrate.",NRU,2016
583816,LAO_47_1992.txt.156,mankind.,LAO,1992
1896076,ECU_69_2014.txt.111,and youth labour have been substantially reduced.,ECU,2014
881116,THA_51_1996.txt.239,my delegation believes that now is the time for greater,THA,1996
441386,BWA_41_1986.txt.128,"Another serious menace in the world today is terrorism - terrorism, naked, brutal and evil.",BWA,1986
1163829,BRN_56_2001.txt.44,Palestine is still denied to what is now a third,BRN,2001
434300,SAU_40_1985.txt.10,"The eternal message of Islam unites and does not divide, establishes justice and does not inflict injustice, equalizes and does not discriminate.",SAU,1985
880909,THA_51_1996.txt.32,"session of the General Assembly, for his most",THA,1996
14327,CAF_26_1971.txt.94,223.,CAF,1971
481596,CUB_43_1988.txt.69,"Particular attention should be paid to the position of Mr. Nelson Mandela, whose release from a prison in South Africa has become a matter of universal concern.",CUB,1988
540737,FRA_46_1991.txt.1,﻿,FRA,1991
289784,CHN_37_1982.txt.174,Wrangling over the,CHN,1982
1646437,VEN_64_2009.txt.754,"stated, as the then head of the Cuban State, ‘A species",VEN,2009
1586331,USA_63_2008.txt.166,crushed.,USA,2008
1072870,NOR_54_1999.txt.112,This,NOR,1999
1645257,VAT_64_2009.txt.145,"combat crimes of genocide, ethnic cleansing and any",VAT,2009
1734062,LSO_66_2011.txt.87,leaving the mantle to some of its members to,LSO,2011
1329029,BWA_59_2004.txt.82,countries.,BWA,2004
1083750,SWZ_54_1999.txt.306,with this need for reform of the Security Council and that,SWZ,1999
1856482,MHL_68_2013.txt.1,It is my honour to convey to,MHL,2013
1523443,RWA_62_2007.txt.98,that resources be made available on an urgent basis to,RWA,2007
1609109,GNQ_64_2009.txt.3,"Affairs of the Libyan Arab Jamahiriya, on his",GNQ,2009
717599,LBR_49_1994.txt.159,"With remarkable success, the ECOWAS",LBR,1994
1125308,LBR_55_2000.txt.130,programmes.,LBR,2000
2028130,COM_75_2020.txt.5,As-salamu alaykum,COM,2020
27399,RUS_26_1971.txt.173,128.,RUS,1971
162069,NPL_32_1977.txt.56,The United Nations has been seized of this question ever since its inception.,NPL,1977
1020135,UZB_53_1998.txt.183,It is common knowledge that the drying up of,UZB,1998
778061,HND_50_1995.txt.349,all”.,HND,1995
1923606,PRT_69_2014.txt.79,Today,PRT,2014
454929,SGP_41_1986.txt.24,"Even more wisely, the Member States endorsed his actions at the resumed session of the General Assembly in April this year.",SGP,1986
72673,SLV_28_1973.txt.24,"While El Salvador, basing itself on the political logic on which this attitude is founded, shares this approach, I should like, following this same logic out to the very end, that the modification should not be limited to a single aspect, the importance of which is self-evident but which of course does not exhaust the series of problems of the Security Council and much less those inherent in the Charter.",SLV,1973
1673434,KAZ_65_2010.txt.199,"efforts of Member States, UNESCO and other",KAZ,2010
261203,HUN_36_1981.txt.46,The emergence of that particularly inhumane weapon of moss destruction in the military arsenal is a consequence of the fallacious doctrine that proclaims	the possibility of a limited nuclear war and brings closer the danger of a nuclear holocaust.,HUN,1981
363662,BEN_38_1983.txt.147,"That resolution called for direct negotiations between the Kingdom of Morocco and POLISARIO,' for a cease-fire and for the organization among the people of Western Sahara of a referendum on self-determination before the end of December 1983 [we ,4/33/37.2].",BEN,1983
1625340,MMR_64_2009.txt.52,community to respond immediately and effectively.,MMR,2009
1450960,ITA_61_2006.txt.143,"negotiation which has thus far eluded us, a period in",ITA,2006
644612,KGZ_48_1993.txt.107,"For the world community, for large and small countries,",KGZ,1993
298450,DJI_37_1982.txt.285,261.,DJI,1982
771378,FJI_50_1995.txt.63,"decades ago, when our frail canoe embarked on its long",FJI,1995
776396,GRC_50_1995.txt.327,continue to contribute substantially to the country’s,GRC,1995
209533,KHM_34_1979.txt.179,"The Government of Democratic Kampuchea, the only legal and legitimate representative of the people of Kampuchea, concerned to ensure the survival of the nation and people of Kampuchea, calls on all international organizations and all countries that cherish peace, justice and independence to provide their humanitarian aid to the Kampuchean people.",KHM,1979
301848,ESP_37_1982.txt.4,in his experience and knowledge of the questions,ESP,1982
1969140,SEN_71_2016.txt.46,"At the same time, I would call for the immediate implementation of the “Strengthening assistance for complex contract negotiations” initiative of the Group of Seven, especially in the area of mines and hydrocarbons.",SEN,2016
1871012,SSD_68_2013.txt.117,"reduced Government spending by 40 per cent, and at",SSD,2013
1525798,SMR_62_2007.txt.261,of the Security Council.,SMR,2007
1260221,TON_57_2002.txt.40,"A number of key Government agencies, including civil",TON,2002
539567,DJI_46_1991.txt.9,"His tolerance, his tenacity, his discretion and his modesty deserve our admiration.",DJI,1991
4700,ISL_25_1970.txt.5,"I wish to take this opportunity to express my appreciation to your predecessor in the presidential chair, Her Excellency Mrs. Angie BrooksRandolph, who presided over the last session with gracious dignity and great skill.",ISL,1970
1212346,ZAF_56_2001.txt.10,"Mr. Kofi Annan, on being elected to a second term and,",ZAF,2001
1816154,TTO_67_2012.txt.42,“We recognize the responsibility which we have,TTO,2012
1515692,MRT_62_2007.txt.138,competition   as was noted by national and,MRT,2007
685446,AZE_49_1994.txt.317,But the,AZE,1994
1415704,SDN_60_2005.txt.46,We are fully committed to the letter and the spirit,SDN,2005
501903,DJI_44_1989.txt.45,"Needless to say, this requires courage and iconoclastic vision on the part of those institutions.",DJI,1989
201966,CUB_34_1979.txt.237,"The Conference took into account the neo- colonialist efforts to prevent the developing countries from exercising their full, permanent and effective sovereignty over those natural resources and reaffirmed this right.",CUB,1979
140779,SOM_31_1976.txt.257,239.,SOM,1976
1754484,THA_66_2011.txt.61,Thailand is convinced that the three pillars of the,THA,2011
1666259,GEO_65_2010.txt.388,stake than we have in seeing Russia turn into a country,GEO,2010
538804,CRI_46_1991.txt.32,It is absurd to claim that the crisis has ended so long as solid peace and stable democracy have not extended to all the countries of the isthmus.,CRI,1991
1906078,ISR_69_2014.txt.250,fighting a fanaticism today that other countries may be,ISR,2014
1555499,HND_63_2008.txt.139,funds to those big banks.,HND,2008
1341334,GRC_59_2004.txt.123,Particular,GRC,2004
1632946,PRT_64_2009.txt.287,listened to by the parties.,PRT,2009
816132,UGA_50_1995.txt.103,recognition of the role of the affected regions in the,UGA,1995
1216530,BEL_57_2002.txt.122,"cooperation, one that derives not from paternalism but",BEL,2002
1230778,GIN_57_2002.txt.78,"widened further the gap between the parties,",GIN,2002
141222,SWE_31_1976.txt.118,Another problem which is continuously in the forefront of the United Nations is the situation in the Middle East.,SWE,1976
269287,PAN_36_1981.txt.191,"Yet, to tell the truth, we must admit that many of the difficulties lie in the fact that we ourselves, we of the ""South"", have not progressed enough to be able to come to agreement and put forward a joint development program.",PAN,1981
273539,TGO_36_1981.txt.156,133.,TGO,1981
284923,BHS_37_1982.txt.245,rights.,BHS,1982
1717155,DNK_66_2011.txt.140,commitments remain the keys to success.,DNK,2011
1223225,COL_57_2002.txt.232,employment  to begin to pay the social debt.,COL,2002
1132384,MMR_55_2000.txt.108,One such question I wish to bring to the,MMR,2000
1250424,PER_57_2002.txt.13,history rational.,PER,2002
1650478,ATG_65_2010.txt.199,That country has sought international,ATG,2010
1589597,AGO_64_2009.txt.3,congratulate Mr. Ali Treki on his election to preside,AGO,2009
1722794,GMB_66_2011.txt.197,address the food security needs of developing,GMB,2011
862602,MHL_51_1996.txt.37,"Excellency Mr. Amata Kabua, emphasized the unity and",MHL,1996
1705459,ATG_66_2011.txt.370,"regional economic and financial crises, ECCU",ATG,2011
1438870,CYP_61_2006.txt.140,bicommunal federation.,CYP,2006
1175476,GIN_56_2001.txt.273,"exploitation of natural resources, the traffic in weapons",GIN,2001
1884279,ATG_69_2014.txt.344,equality and the rights of the disabled.,ATG,2014
447444,IRL_41_1986.txt.24,"It has nurtured the process of decolonization, which has seen over 100 States come to independence.",IRL,1986
1344304,IRN_59_2004.txt.37,approach based on collective cooperation under the,IRN,2004
759913,BRA_50_1995.txt.46,We expect from our partners an attitude of,BRA,1995
1548211,DMA_63_2008.txt.86,Most of those States are incapable of starting any,DMA,2008
524595,IRL_45_1990.txt.80,"While we regret that the Conference was unable to adopt a concluding document, we believe that the discussions have reinforced a commitment to the Treaty, and we look forward to redoubling efforts to ensure a successful outcome of the 1995 Review Conference and to agreement on extension of this vital Treaty.",IRL,1990
581984,KAZ_47_1992.txt.170,"and security in our continent of Asia or, more broadly, in Eurasia.",KAZ,1992
1587706,VNM_63_2008.txt.52,peaceful solutions to the conflicts and disputes that still,VNM,2008
1795470,LVA_67_2012.txt.111,Latvia is already engaged in training Afghan experts,LVA,2012
1650022,ARG_65_2010.txt.341,a Council that could strike a balance between the,ARG,2010
1342966,HUN_59_2004.txt.124,We should continue our efforts in the field of,HUN,2004
451154,MNG_41_1986.txt.42,"My delegation calls upon all other nuclear-weapon states, above all the United States, to join in the moratorium and to start wording out an agreement on a comprehensive ban of nuclear-weapon tests.",MNG,1986
1071930,NGA_54_1999.txt.122,"experiencing import compression, weak productivity and",NGA,1999
262717,ISR_36_1981.txt.82,Arab and Soviet bloc supporters of Syria and the PLO have made any such condemnation impossible.,ISR,1981
763962,COD_50_1995.txt.371,We trust that efforts will be made to ensure that further,COD,1995
1926759,SLB_69_2014.txt.352,our time.,SLB,2014
100050,BGR_30_1975.txt.152,The course of historical development shows that the desire of the peoples for a limitation of the arms race and for effective disarmament always faces stubborn opposition.,BGR,1975
593881,OMN_47_1992.txt.208,"countries overcome their environmental problems, by way of consolidating the",OMN,1992
1577144,SDN_63_2008.txt.200,"the intransigence of the non-signatories, threatening",SDN,2008
928881,MCO_52_1997.txt.228,"the Commission on Sustainable Development, some quite",MCO,1997
130419,IRL_31_1976.txt.169,"We must reject the spurious claim of such groups to promote justice by their barbarous actions; we must together work out effective means to bring these atrocities to an end, and we must complement the action we take by continuing our own sustained efforts both as individual States and through this world Organization to promote a more just and peaceful world order.",IRL,1976
1506673,JPN_62_2007.txt.279,will make efforts to continue our refuelling activities in,JPN,2007
312888,IDN_37_1982.txt.216,solution to the conflict.,IDN,1982
531085,RUS_45_1990.txt.97,Of course the United Nations itself will have to play the primary role in this.,RUS,1990
832817,CIV_51_1996.txt.374,primary purpose of ensuring national cohesion and progress.,CIV,1996
1665277,GAB_65_2010.txt.41,"efforts to promote our natural resources, while",GAB,2010
1078100,QAT_54_1999.txt.156,"disputes and regional, bilateral and internal conflicts.",QAT,1999
731744,OMN_49_1994.txt.121,The desired just and lasting peace will prevail only,OMN,1994
174300,COD_33_1978.txt.148,205.,COD,1978
220892,URY_34_1979.txt.144,319.,URY,1979
190147,RUS_33_1978.txt.134,69.,RUS,1978
352591,TUR_37_1982.txt.94,"hope that, despite the convulsions it has",TUR,1982
1043664,ETH_54_1999.txt.588,to insist — not without sacrifice — that there should be,ETH,1999
2029280,ESP_75_2020.txt.15,The pandemic has widened the injustice and vulnerability gap.,ESP,2020
1515802,MUS_62_2007.txt.32,Conflicts in some parts of Africa,MUS,2007
54172,ARE_28_1973.txt.40,"So long as the people of Palestine are denied their basic rights, there can be no peace in the Middle East.",ARE,1973
521286,DEU_45_1990.txt.260,"They must be complemented by measures to ensure basic economic and social security, gradually to rectify the unjust distribution of income and to improve educational opportunities in many countries.",DEU,1990
1463425,NLD_61_2006.txt.242,"peace and stability, in debating human rights issues, or",NLD,2006
1356686,MYS_59_2004.txt.292,the institution where the principles of international law,MYS,2004
1195616,NPL_56_2001.txt.281,Nepal,NPL,2001
1993108,CPV_73_2018.txt.54,"We see this situation in our growing regional asymmetries, which are exacerbated by the lack of territorial continuity that goes with being an island nation, the nefarious effects of drought, desertification and other climate changes, as well as weak production capacity, unemployment of young people, social and gender inequalities, the excessive burden of external debt on the budget, and the difficulties in internally connecting our country by air and sea, which hampers the creation of a competitive and coherent market, which is essential for developing tourism.",CPV,2018
983211,HUN_53_1998.txt.164,"In this regard, we feel that respect for the rule of",HUN,1998
1636861,SLV_64_2009.txt.431,"on the intelligence, honour and generosity of the larger",SLV,2009
1464788,PAK_61_2006.txt.6,significant role that women are playing in the Muslim,PAK,2006
1015676,THA_53_1998.txt.347,the lives and dreams they shatter on a daily basis.,THA,1998
36249,COD_27_1972.txt.26,"Here I should like to point out that, instead of merely abandoning its project for the construction of the Inga hydro-electric dam, which had not aroused any interest on the part of equipped countries and the international bodies approached for financing it, the Republic of Zaire decided to build it with its own resources, come what may.",COD,1972
339622,POL_37_1982.txt.91,"would have been the loss, on a mass scale, of a",POL,1982
882012,TKM_51_1996.txt.248,countries.,TKM,1996
32155,ZAF_26_1971.txt.114,"Although our social, political and economic systems may differ, experience has proved that there need be no barriers to co-operation between parties with a common interest in Africa's welfare.",ZAF,1971
423559,DEU_40_1985.txt.96,"The attempt to establish a universal prohibition of chemical weapons is still being hampered by the outstanding verification issues, which must now be tackled with vigor.",DEU,1985
1346911,KAZ_59_2004.txt.234,Conference.,KAZ,2004
146596,BGR_32_1977.txt.86,"Although there are some who cannot conceive of the contemporary world without the use of force and are even convinced that its prohibition would almost create a vacuum in the international legal order, it becomes increasingly evident that the conclusion of a world treaty on this matter would greatly advance the process of detente.",BGR,1977
1256004,SLE_57_2002.txt.257,Declaration to meet the special needs of Africa.,SLE,2002
1267659,ARM_58_2003.txt.133,"security, their lives and their futures.",ARM,2003
1968939,RWA_71_2016.txt.4,Now is the time for implementation.,RWA,2016
1647063,VUT_64_2009.txt.164,the small island countries in convincing the world that,VUT,2009
1391003,ESP_60_2005.txt.120,Council and are fully prepared to contribute actively to,ESP,2005
1324927,BEN_59_2004.txt.33,"purpose, which is to promote international peace and",BEN,2004
1985301,PSE_72_2017.txt.159,"Once we delineate the borders, each party can act in its territory as it pleases without affecting or damaging the rights of the other party.",PSE,2017
1030037,BIH_54_1999.txt.257,endanger the role of the Organization as a vital and,BIH,1999
127017,EGY_31_1976.txt.14,5.,EGY,1976
248950,VEN_35_1980.txt.56,That is why he has affirmed his belief in a more just and more humane international law based on the development of the human person and of all men.,VEN,1980
1123464,KNA_55_2000.txt.181,"of women, which allowed Member States to review and",KNA,2000
385854,SYR_38_1983.txt.58,"The Napoleonic expedition was another version, followed by frequent resort to military threats in the nineteenth century, especially during the events in Lebanon between the years 1840 and 1860.",SYR,1983
943282,RWA_52_1997.txt.293,"Since February 1997, these fugitives have",RWA,1997
1589258,ZMB_63_2008.txt.227,"agricultural systems, thereby condemning millions",ZMB,2008
804719,PRK_50_1995.txt.286,the Korean peninsula will certainly be resolved smoothly.,PRK,1995
835688,CYP_51_1996.txt.167,It is in this,CYP,1996
309455,GRD_37_1982.txt.230,Bank's operations where action has been taken or is under way to,GRD,1982
1086793,TUN_54_1999.txt.389,It will,TUN,1999
2001304,NOR_73_2018.txt.7,Both our prosperity and many of our challenges are the result of global trends.,NOR,2018
827238,BHR_51_1996.txt.333,practices and forswear its plans to change the Arab and,BHR,1996
1714885,CPV_66_2011.txt.44,and lifestyle of Cape Verdeans.,CPV,2011
1026737,AZE_54_1999.txt.141,Azerbaijan reaffirms its commitment to a peaceful,AZE,1999
175731,CYP_33_1978.txt.46,"If they could be translated into practical action—and it is up to the States Members of this Organization to do so-they would provide the solution to nearly all the problems facing the world today, whether they be problems of international peace and security, problems of economic relations between States, problems of human rights or problems of international law.",CYP,1978
1671856,ISL_65_2010.txt.159,"Geothermal by itself, of",ISL,2010
1498170,GAB_62_2007.txt.71,"prepared to go much further, because protection of the",GAB,2007
522372,FJI_45_1990.txt.15,There have been enough instances to show that later unification is not precluded by initial separate membership of the United Nations.,FJI,1990
1639615,SYR_64_2009.txt.186,This has not yet,SYR,2009
1136134,NIC_55_2000.txt.14,"Mr. Theo-Ben Gurirab, for the dedicated way in which",NIC,2000
976169,FIN_53_1998.txt.150,"easy to use, small arms are the main tools of violence in",FIN,1998
1422931,TUV_60_2005.txt.63,countries and small island developing States like,TUV,2005
1878818,USA_68_2013.txt.686,into submission?,USA,2013
1927650,SMR_69_2014.txt.90,"the conflict, without exception.",SMR,2014
1989302,YEM_72_2017.txt.33,They remain a threat to our country and the entire world.,YEM,2017
981913,GUY_53_1998.txt.260,elimination of poverty â€” are indispensable to the,GUY,1998
1102454,CHN_55_2000.txt.230,others.,CHN,2000
1434579,BWA_61_2006.txt.28,"24 September 1969, he described Botswana, in part, as",BWA,2006
411513,PNG_39_1984.txt.11,317.,PNG,1984
1815430,TKM_67_2012.txt.175,comprehensive development of humanity and bearing in,TKM,2012
1497576,FRA_62_2007.txt.31,Remember the genocide of the,FRA,2007
1000939,NAM_53_1998.txt.159,and equity.,NAM,1998
1640995,TJK_64_2009.txt.292,the price of freshwater currently exceeds that of petrol.,TJK,2009
1220524,BWA_57_2002.txt.200,The people of,BWA,2002
80452,CMR_29_1974.txt.129,85.,CMR,1974
1601905,CYP_64_2009.txt.77,Tomorrow will be too,CYP,2009
422468,COL_40_1985.txt.26,"It was evident that the noting system proposed would place questions of war and peace in the hands of one of the five Powers, contradicting the principle by which the problems of the international Organization should be resolved by simple majority.",COL,1985
576920,HRV_47_1992.txt.58,At the same,HRV,1992
1963416,ISR_71_2016.txt.117,"However, one thing I will never negotiate is our right to our State, the one and only Jewish State.",ISR,2016
1725220,HRV_66_2011.txt.194,forces and the Security Council took the right approach,HRV,2011
1858905,MOZ_68_2013.txt.142,development and full participation in the global agenda.,MOZ,2013
995091,MCO_53_1998.txt.39,from the Azores to Spitzberg.,MCO,1998
1431915,BHS_61_2006.txt.11,The Government and people of,BHS,2006
1207683,TUN_56_2001.txt.165,effective role so as to spare the Middle East from the,TUN,2001
1107710,DOM_55_2000.txt.83,In the,DOM,2000
454585,SAU_41_1986.txt.37,"It is unnecessary to reaffirm the fact that no solution is likely to succeed if it does not include the Palestine Liberation Organization, the sole legitimate representative of the Palestinian people, as one of the elements of the quest and a party to the dialog.",SAU,1986
1601852,CYP_64_2009.txt.24,"through economic nationalism, that we can overcome",CYP,2009
1115062,GRC_55_2000.txt.147,United Nations from an Organization working to,GRC,2000
1677598,LTU_65_2010.txt.93,That is a,LTU,2010
1626104,MNG_64_2009.txt.228,"economic, social and spiritual areas of the life of our",MNG,2009
1930414,SYC_69_2014.txt.77,priority is the need to build opportunities for SIDS,SYC,2014
1632697,PRT_64_2009.txt.38," We are all affected by climate change, but it is",PRT,2009
1047998,GMB_54_1999.txt.262,"As a result, in June of this year we",GMB,1999
671257,SVN_48_1993.txt.271,"footing, on the succession of the former Yugoslavia.",SVN,1993
1711196,BRN_66_2011.txt.122,throughout this year in all international gatherings we,BRN,2011
1717099,DNK_66_2011.txt.84,"More than 2,600 people in Syria have died",DNK,2011
1307975,RUS_58_2003.txt.58,"everywhere, and the fact that the inciters of terror are",RUS,2003
1424106,URY_60_2005.txt.59,governing means managing with efficiency and,URY,2005
1035784,COL_54_1999.txt.329,"Colombia, amidst its difficulties and problems, does",COL,1999
535458,ATG_46_1991.txt.116,He have condemned continuously the unjust economic systems which have caused civil wars to erupt in Central America.,ATG,1991
926895,LSO_52_1997.txt.111,our Organization.,LSO,1997
268823,OMN_36_1981.txt.99,"In this connection it Is relevant to refer to the International Conference on Assistance to Refugees in Africa, which was held successfully at Geneva last April.",OMN,1981
1542099,BRA_63_2008.txt.9,predicted economic and financial crisis is now today’s,BRA,2008
636773,GUY_48_1993.txt.416,At the commissioning ceremony held on World,GUY,1993
1769092,BIH_67_2012.txt.263,If the,BIH,2012
1936513,VCT_69_2014.txt.359,great deal of global violence and unrest.,VCT,2014
1248938,NOR_57_2002.txt.233,"against poverty and injustice, as well as in the long-",NOR,2002
1034449,CMR_54_1999.txt.228,Africa.,CMR,1999
52847,USA_27_1972.txt.203,"The United States urges this Assembly to act, and act at once, to meet this challenge.",USA,1972
514428,TUN_44_1989.txt.44,"In the case of the fraternal African country of Namibia and its national leadership, the South West Africa People's Organization, such guarantees are all the more imperative in view of the disinformation campaigns and other suspicious manoeuvres that the South African regime is capable of concocting.",TUN,1989
1737006,MHL_66_2011.txt.234,International Civil Aviation Organization.,MHL,2011
192653,SYC_33_1978.txt.155,"It is not the case that we have simply invented the phrase ""technical co-operation among developing countries"" as a meaningless slogan nor that it is a flash of inspiration on the part of some economics professor about how to improve things.",SYC,1978
440488,BLR_41_1986.txt.147,"Indeed it does, but only for the few.",BLR,1986
1628294,NGA_64_2009.txt.207,Because of the strong commitment on the part of all,NGA,2009
1986093,SLE_72_2017.txt.39,My country has indeed benefited from mediation efforts under the auspices of the United Nations and the Economic Community of West African States.,SLE,2017
666249,RWA_48_1993.txt.163,is the result of a miracle of international solidarity.,RWA,1993
904261,DEU_52_1997.txt.346,of Africa.,DEU,1997
1078984,RUS_54_1999.txt.398,The gap between the industrial and the,RUS,1999
