,doc_id,text,country,year
136476,NIC_31_1976.txt.132,In that spirit we participated in the Third Ministerial Meeting at Manila which approved the declaration and plan of action of the Group of 77.,NIC,1976
1055494,JAM_54_1999.txt.268,which has for so long impeded the progress of that,JAM,1999
1652196,BEL_65_2010.txt.124,product on development cooperation.,BEL,2010
1568042,MMR_63_2008.txt.155,"child transmission and community, institution and",MMR,2008
1243156,MDA_57_2002.txt.159,rights on the world stage.,MDA,2002
289741,CHN_37_1982.txt.131,co-operation and scientific-technological,CHN,1982
362824,AUT_38_1983.txt.128,crucial importance that these trends be transformed into,AUT,1983
1875343,TON_68_2013.txt.137,Development Goals Acceleration Framework and,TON,2013
1634455,RUS_64_2009.txt.387,I,RUS,2009
914604,GTM_52_1997.txt.183,"Central American leaders, have come together to this",GTM,1997
1307086,PSE_58_2003.txt.70,"Israel lays the blame on Arafat, after it",PSE,2003
427954,JAM_40_1985.txt.97,These problems and the plight of our countries have been seriously exacerbated by the continuation of unfavorable international economic conditions.,JAM,1985
46797,NIC_27_1972.txt.163,"In all that I have said here in terms of the general lines of the policy followed by the National Government Junta of Nicaragua, there is only the most fervent faith that my country and its Government have in this Organization as a moral beacon and the seedbed of positive law in which peoples that love peace should cement their hopes for the future.",NIC,1972
1778078,ECU_67_2012.txt.106,able to veto the remaining 97.5 per cent.,ECU,2012
288820,CHL_37_1982.txt.2,its President carry out the important duties,CHL,1982
1122330,KAZ_55_2000.txt.308,This,KAZ,2000
1279695,DOM_58_2003.txt.147,is making efforts to ensure that at the primary level,DOM,2003
46006,MRT_27_1972.txt.168,"The Royal Government of National Union of Cambodia, under the enlightened leadership of Prince Sihanouk, today controls over 80 per cent of the territory and the population of the country.",MRT,1972
244891,SGP_35_1980.txt.18,89.,SGP,1980
951935,UKR_52_1997.txt.58,security and stability throughout the world.,UKR,1997
1921201,PAK_69_2014.txt.232,largest troop-contributing country.,PAK,2014
1434602,BWA_61_2006.txt.51,development partners from all continents.,BWA,2006
700364,ECU_49_1994.txt.239,assistance for the victims in Rwanda.,ECU,1994
1828913,BLZ_68_2013.txt.191,While Belize appreciates that the activities of,BLZ,2013
92675,PRT_29_1974.txt.97,Respect for the principles of independence and equality among States and /ion-interference in the internal affairs of other countries.,PRT,1974
298165,DEU_37_1982.txt.1003,effective strategy for the safeguarding of peace.,DEU,1982
1171566,EGY_56_2001.txt.360,"violence and hatred that are born of illegal, unjust",EGY,2001
789784,LKA_50_1995.txt.419,"Chairman of the Ad Hoc Committee, has been in",LKA,1995
1392523,FSM_60_2005.txt.132,economic progress and collective security.,FSM,2005
1388669,CZE_60_2005.txt.164,HIV/AIDS?,CZE,2005
159175,MAR_32_1977.txt.233,124.,MAR,1977
2002592,PRT_73_2018.txt.22,"With regard to multilateralism and international law in the area of oceans and maritime security, Portugal is actively involved in preparations for the second United Nations Ocean Conference, in 2020, and stands ready to assume all responsibilities related to that.",PRT,2018
1780627,FJI_67_2012.txt.68,"less burdened, and generations given a better chance to",FJI,2012
853204,JPN_51_1996.txt.44,future generations must be based on the following three,JPN,1996
1691395,SLB_65_2010.txt.114,issues of human rights.,SLB,2010
538764,CPV_46_1991.txt.97,The need for United Nations reform has already led to some administrative and financial adjustments in its structure and more recently in the functioning of the Economic and Social Council.,CPV,1991
844315,GIN_51_1996.txt.9,His election is testimony to the international,GIN,1996
1856406,MEX_68_2013.txt.178,a meeting in Mexico to promote a global perspective,MEX,2013
336728,PAN_37_1982.txt.306,The TreatiesI that arose from those negotiations,PAN,1982
232213,GNB_35_1980.txt.92,"It is estimated that today there are 5 million of these unfortunate people in Africa, 5 million human beings fleeing death in tragic circumstances and compelled to live more often than not in indescribable poverty.",GNB,1980
172290,BOL_33_1978.txt.132,"Meanwhile, local wars not only do not disappear but are multiplying.",BOL,1978
1464683,OMN_61_2006.txt.90,has launched a national strategy aimed at protecting the,OMN,2006
1314176,THA_58_2003.txt.111,Domestic legislation,THA,2003
685904,BDI_49_1994.txt.223,Such a conference could pave the way for the creation of,BDI,1994
853944,KAZ_51_1996.txt.289,session on environment and sustainable development in the,KAZ,1996
1277758,CUB_58_2003.txt.37,"No, it does not.",CUB,2003
790150,LSO_50_1995.txt.221,"December 1994, in which it decided to undertake, at its",LSO,1995
1810402,SLV_67_2012.txt.177,small portion of humankind is able to enjoy remains,SLV,2012
276690,AGO_37_1982.txt.2,"behalf of the Government of the People's Republic of Angola, our most",AGO,1982
320003,KEN_37_1982.txt.300,now ready for the implementation of Namibia's,KEN,1982
179206,GHA_33_1978.txt.114,"If the peace initiatives and the meetings at Camp David have not produced a dramatic and final result, one would hope that the agreement reached has at least contributed to a better understanding of the fears and concerns of some of the contestants and laid a foundation for more productive future negotiations for a settlement.",GHA,1978
1100830,BWA_55_2000.txt.87,conditions for national reconciliation in that country,BWA,2000
522567,FRA_45_1990.txt.104,And at the end of that road we must take up the idea of an international conference as the catalyst and the qurator of the implementation of any successful negotiation.,FRA,1990
835539,CYP_51_1996.txt.18,"the same time, we acknowledged that our main",CYP,1996
515163,UKR_44_1989.txt.159,Our policy of asserting the supremacy of international law is intimately related to the process of creating our own State based on a genuine rule of law.,UKR,1989
744806,TTO_49_1994.txt.236,Agenda for Development as a necessary complement to the,TTO,1994
514674,TZA_44_1989.txt.25,The international community must recognize that these are the same old tricks that the regime has used in the past to ward off international pressure.,TZA,1989
1585378,TZA_63_2008.txt.342,I urge,TZA,2008
836980,DJI_51_1996.txt.198,an integral part of it.,DJI,1996
892428,AZE_52_1997.txt.331,There is an effective mechanism for,AZE,1997
461747,COD_42_1987.txt.37,The summit meeting of the super-Powers is therefore awaited with great interest with a view to the conclusion of the agreement that has now been achieved by the foreign ministers.,COD,1987
620574,CHN_48_1993.txt.196,We also believe that humanitarian,CHN,1993
1987990,TUV_72_2017.txt.100,Tuvalu strongly believes that the United Nations must engage in setting a clear pathway to address these issues and the issue of self-determination for the people of West Papua.,TUV,2017
825002,BEL_51_1996.txt.171,to guarantee the reconstruction and sustainable,BEL,1996
112651,NGA_30_1975.txt.163,"However, the Federal Military Government also believes that certain self-evident facts should unite all Members of the United Nations on an issue such as apartheid, which is so abhorrent to our Charter.",NGA,1975
1052713,IRL_54_1999.txt.57,that are vital to this conflict prevention.,IRL,1999
1915261,MKD_69_2014.txt.300,"issues as integration, our economies, infrastructure,",MKD,2014
895223,BHR_52_1997.txt.448,While we look forward to such a comprehensive,BHR,1997
1302274,NIC_58_2003.txt.21,equally bound by international law.,NIC,2003
1534422,VUT_62_2007.txt.128,Development Policy should also be encouraged to,VUT,2007
1254440,SAU_57_2002.txt.360,and interaction among peoples will be raised in order,SAU,2002
97291,VEN_29_1974.txt.105,"The financial contributions made by Venezuela are equivalent to 1.2 per cent of its gross national product, and it is relevant to point out that the pledges made by the industrialized countries to assist the developing nations along these lines in most cases do not even reach one percent of their gross national product.",VEN,1974
417561,VEN_39_1984.txt.214,Venezuela is prepared to make its contribution in all fields of necessary action.,VEN,1984
1870099,SOM_68_2013.txt.47,"such as Al-Shabaab in the Horn of Africa, is far from",SOM,2013
1188079,LVA_56_2001.txt.143,"participating, with troops and personnel, in all United",LVA,2001
1739065,MOZ_66_2011.txt.122,"of nations, through its organs, in particular the Security",MOZ,2011
815952,TZA_50_1995.txt.356,"United Nations agencies, especially UNCTAD, which will",TZA,1995
914603,GTM_52_1997.txt.182,"We, the",GTM,1997
562758,CAN_47_1992.txt.260,"And let me add, we believe that countries that make",CAN,1992
1739881,MUS_66_2011.txt.359,Article 33 spells out the means and ways of,MUS,2011
1547572,CZE_63_2008.txt.55,international peace and security and to shoulder its,CZE,2008
151663,EGY_32_1977.txt.113,"If the Israeli leaders were genuine in their call, those among them who pay lip-service to peace would not have permitted themselves to declare daily that they insist on annexing territories and ignoring the existence of the people who have been, and still are, the owners of the land and have established rights there.",EGY,1977
1010331,SEN_53_1998.txt.60,"the goals that are before us, our Member States have the",SEN,1998
760652,BRB_50_1995.txt.271,premature.,BRB,1995
828502,BLZ_51_1996.txt.135,massive to be swallowed whole.,BLZ,1996
428588,KHM_40_1985.txt.94,"""Le Monde, 8 May 1985: The Vietnamese at grips with the guerrillas, by Philippe Pons.",KHM,1985
857545,LBY_51_1996.txt.142,through the return of the Palestinians to their homeland,LBY,1996
1875671,TTO_68_2013.txt.299,the preparations for our participation in that upcoming,TTO,2013
1553751,GMB_63_2008.txt.276,under serious stress because of the flight of trained,GMB,2008
1398229,ISR_60_2005.txt.48,"economic benefits, as Israel's improving relations with",ISR,2005
1915262,MKD_69_2014.txt.301,"energy, environmental protection, terrorism and the",MKD,2014
30031,TTO_26_1971.txt.49,involve the accelerated implementation of the policies of the first two sessions of the United Nations Conference on Trade and Development.,TTO,1971
62324,GTM_28_1973.txt.9,200.,GTM,1973
2010979,COM_74_2019.txt.68,The United Nations is seeing its missions multiply with every new challenge that emerges in the world.,COM,2019
813433,THA_50_1995.txt.110,ponder the work on the reform of the Security Council.,THA,1995
607738,YEM_47_1992.txt.202,The,YEM,1992
234893,IRQ_35_1980.txt.76,"After the death of Barzani his sons and followers returned to Iran, where they were granted refuge, assistance and permission to use Iranian territory as a base of operations for threatening Iraq and interfering with its internal security and national integrity.",IRQ,1980
1233784,HTI_57_2002.txt.212,"2001, in accordance with OAS resolutions 806 and",HTI,2002
1817308,TUV_67_2012.txt.209,"is well known, sea-level rise and f looding threaten",TUV,2012
1938846,ZMB_69_2014.txt.105,"climate change, global poverty, public health, children’s",ZMB,2014
1314843,TJK_58_2003.txt.434,"international community, embodied by the United",TJK,2003
30894,UKR_26_1971.txt.110,"This requires increased efforts in the search for a stable and lasting peace in this region, which in its turn would promote the strengthening of universal peace.",UKR,1971
1813808,SYC_67_2012.txt.132,"fuel prices, SIDS can strengthen their resilience through",SYC,2012
709338,HTI_49_1994.txt.5,I thank him with all my heart for the ties of solidarity he has woven with the Haitian people.,HTI,1994
302020,ESP_37_1982.txt.176,The grave situation in Central,ESP,1982
28601,SLE_26_1971.txt.224,106.,SLE,1971
230174,EGY_35_1980.txt.23,"As a member of the Group of 77, Egypt realizes full well that its economic salvation must ultimately lie in self-reliance.",EGY,1980
1938287,YEM_69_2014.txt.151,Partnership Agreement.,YEM,2014
1651952,BDI_65_2010.txt.110,groups and developing projects and programmes that,BDI,2010
757130,BGD_50_1995.txt.36,"In the wake of the cold war, the United Nations is",BGD,1995
1270826,BGR_58_2003.txt.1,"﻿Allow me, at the outset, to congratulate you",BGR,2003
165362,SLV_32_1977.txt.13,Therefore we can in no way attribute to a deficiency in the Organization or to inefficacy on its part the fact that certain items remain for ever on the agenda of the Assembly.,SLV,1977
698584,DJI_49_1994.txt.413,neighbours or the world.,DJI,1994
1976808,DNK_72_2017.txt.69,"Denmark welcomes the vision of the Secretary-General for the peace and security architecture of the United Nations with a streamlined, coordinated and effective response in the field.",DNK,2017
1822341,ZWE_67_2012.txt.165,"anyway, it is still being debated.",ZWE,2012
507567,LKA_44_1989.txt.84,Such frustrations have fuelled strong radical views.,LKA,1989
378490,MDV_38_1983.txt.39,Developments during the past year have increased the gravity of the situation.,MDV,1983
1295374,LIE_58_2003.txt.103,The Council has opened up to the membership,LIE,2003
806358,QAT_50_1995.txt.344,affairs of other States or as justification for discriminatory,QAT,1995
961216,BEN_53_1998.txt.245,spirit of tolerance and sharing.,BEN,1998
1773468,CHN_67_2012.txt.354,relations and overall stability in the region.,CHN,2012
136754,NLD_31_1976.txt.218,They underline their continuing commitment to the independence and territorial integrity of Lebanon.,NLD,1976
473489,SEN_42_1987.txt.98,"The question of knowing what role such a negotiating forum should play and who the actors will be should not, in the view of Senegal, continue to block the efforts of the international community to convene it, if the political will to move ahead is indeed present in everybody.",SEN,1987
462366,CSK_42_1987.txt.56,"We welcome the idea of stepping up the work of the Geneva Conference on Disarmament so that it may gradually become a permanent, universal negotiating body on disarmament.",CSK,1987
1544799,CHN_63_2008.txt.147,respects the sovereignty and territorial integrity of,CHN,2008
481509,CSK_43_1988.txt.167,We support the idea of co-ordinating efforts on these issues and the holding of a series of international meetings on the way to the convening of a United Nations conference on the environment in 1992.,CSK,1988
1445618,GNB_61_2006.txt.261,correctly interpreted.,GNB,2006
505561,IRL_44_1989.txt.151,"If the obligation to move beyond a mere cessation of hostilities is accepted, we, the Members of the United Nations, should be prepared to entrust further responsibilities to our Organization.",IRL,1989
1899867,GEO_69_2014.txt.276,"including medical personnel, staff officers and training",GEO,2014
1803114,NRU_67_2012.txt.175,the crisis.,NRU,2012
851144,IRQ_51_1996.txt.213,"However,",IRQ,1996
149553,CPV_32_1977.txt.25,"Today, while we note that a certain amount of evolution has taken place and that more realistic attitudes are being taken with respect to some questions, a development which we welcome with a sense of relief, the concerns to which we have alluded remain and the progress achieved seems insubstantial.",CPV,1977
58199,COG_28_1973.txt.52,100.,COG,1973
891016,ATG_52_1997.txt.288,The undoing of the Lomé trade agreement and the injury,ATG,1997
51464,TUN_27_1972.txt.40,Thus the super-power of one or another of the Titans is very often projected thousands of kilometers beyond the borders of its own territory.,TUN,1972
1485033,BDI_62_2007.txt.244,number of high-level officials makes it possible to take,BDI,2007
1590742,ARG_64_2009.txt.58,and general rules in this globalized world that must be,ARG,2009
2029718,FIN_75_2020.txt.60,It is not only the common responsibility of all of us — the member states — to make it stronger.,FIN,2020
252491,BLR_36_1981.txt.50,"Yet, is everyone complying with the aforementioned requirements?",BLR,1981
530450,PNG_45_1990.txt.270,"taking place in the Asia-Pacific region, the Middle East and elsewhere, point to",PNG,1990
981258,GRD_53_1998.txt.224,"Earth, with its physical environment, is a divine gift to",GRD,1998
668930,SLB_48_1993.txt.450,Montreal Protocol are under way.,SLB,1993
916167,HUN_52_1997.txt.170,As a legitimate,HUN,1997
695558,COG_49_1994.txt.289,solely in terms of growth; it must also be defined in terms,COG,1994
1860314,NAM_68_2013.txt.71,Namibia is concerned about the conflict situations,NAM,2013
442085,CMR_41_1986.txt.138,"It is hoped that wisdom and tolerance will guide the action of all states in the international arena and that the general interest of the international community will prevail over selfish, sectarian considerations.",CMR,1986
1699338,URY_65_2010.txt.167," In this respect, the existing gap between the",URY,2010
762847,CHL_50_1995.txt.340,"that, rather than endlessly increasing contributions, it is",CHL,1995
87183,JAM_29_1974.txt.111,271.,JAM,1974
365632,BRB_38_1983.txt.136,"We are convinced that only a restructuring of the international economic order will ensure lasting peace, security and prosperity for all the peoples of the world.",BRB,1983
728295,MYS_49_1994.txt.313,"that, it must be animated by the spirit of justice and a bias",MYS,1994
331750,NER_37_1982.txt.39,to express the appreciation of the delegation of,NER,1982
1536105,AGO_63_2008.txt.78,"partnerships for sustainable development, trade,",AGO,2008
1065293,MDG_54_1999.txt.90,situations the most vulnerable sectors of society —,MDG,1999
1838953,EST_68_2013.txt.125,often at the expense of far more vital needs.,EST,2013
758404,BHS_50_1995.txt.179,made States acutely aware that attention must now be,BHS,1995
1059874,LAO_54_1999.txt.143,legitimate representative of the entire Chinese people.,LAO,1999
824443,BDI_51_1996.txt.105,Its aim is to make good the,BDI,1996
1056961,KEN_54_1999.txt.3,President of the General Assembly at its fifty-fourth,KEN,1999
816037,UGA_50_1995.txt.8,relations.,UGA,1995
577393,HTI_47_1992.txt.75,"Likewise, in his work entitled Political Justice.",HTI,1992
738007,SDN_49_1994.txt.346,institutions to assist developing countries have severely,SDN,1994
1054720,ISR_54_1999.txt.274,the common objectives of the nations in our region.,ISR,1999
430486,MMR_40_1985.txt.50,"The fundamental purpose of the United Nations is the maintenance of international peace and security, the promotion of which depends on the development of friendly relations and co-operation among States.",MMR,1985
168013,UKR_32_1977.txt.44,"A. Gromyko, for consideration by the current session of the General Assembly",UKR,1977
1237075,JOR_57_2002.txt.243,region the dire consequences of military operations.,JOR,2002
1886291,BGD_69_2014.txt.18,"coexistence, social justice and freedom from poverty,",BGD,2014
1895151,DNK_69_2014.txt.23,no simple solutions.,DNK,2014
561035,BOL_47_1992.txt.351,"worrying signs of uncertainty, lack of confidence and pessimism.",BOL,1992
2039429,SYR_75_2020.txt.72,Timing will depend on the readiness of our armed forces to march into battle.,SYR,2020
35241,CAN_27_1972.txt.86,But the problem cannot be ignored because it is difficult.,CAN,1972
1837179,DOM_68_2013.txt.59,"Over time, we have reached a situation that we now",DOM,2013
143856,YEM_31_1976.txt.102,Israel remains isolated from the international community.,YEM,1976
1466223,PNG_61_2006.txt.245,nations to fuel our economic growth.,PNG,2006
1994324,ESP_73_2018.txt.70,Perhaps that is because we remember our own country’s history.,ESP,2018
240343,MYS_35_1980.txt.43,"Acceptance of, or even acquiescence in, that would put us all back to the cold war of a bipolar world and would rob us of our precious gains of independent action and the right to progress unthreatened and unimpeded.",MYS,1980
975571,EST_53_1998.txt.78,democracy.,EST,1998
555213,ATG_47_1992.txt.250,Transforming Antarctica into a world park or protected area,ATG,1992
182469,ISR_33_1978.txt.77,These forces will not be removed unless such removal is approved by the Security Council of the United Nations.,ISR,1978
518545,BLZ_45_1990.txt.13,The crisis of the past few months in the Persian Gulf brings home forcefully the realisation that peace is more than the absence of war.,BLZ,1990
1575210,PRT_63_2008.txt.141, Portugal believes that the natural vocation of the,PRT,2008
1988766,VAT_72_2017.txt.109,"As history shows, regional and bilateral treaties on the non-proliferation of nuclear weapons have been effective in establishing whole regions free from these weapons.",VAT,2017
113272,NPL_30_1975.txt.105,The Third United Nations Conference on the Law of the Sea was of great importance to us because of our land-locked character and also because of the fact that the right of free and unrestricted access to and from the sea would not only promote economic development by facilitating trade and industrialization but would also help us partake of the sea resources.,NPL,1975
1284802,GMB_58_2003.txt.440,Development Goals.,GMB,2003
1723441,GNQ_66_2011.txt.179,"young people without physical, intellectual and moral",GNQ,2011
443394,CYP_41_1986.txt.180,how we might proceed forward.,CYP,1986
1464765,OMN_61_2006.txt.172,achievements in the area of childcare.,OMN,2006
415138,SYR_39_1984.txt.49,"Then they pretend to be worried over the present divisions within the Arab fold, and they appeal to us to close ranks, but only under the Israeli umbrella.",SYR,1984
362331,ATG_38_1983.txt.80,"Of course, their response to this charge of lack of consultation will be that the Treaty is open for signature to all, but this ignores the reality that signature does not accord membership in the decision-making commission, nor does it take account of the fact that the presence of South Africa among the Contracting Parties makes it impossible for any State which genuinely opposes the vileness of apartheid to sit in the council of the decision-making commission of the Antarctic Treaty.",ATG,1983
831189,CAN_51_1996.txt.152,It strikes at the very heart of,CAN,1996
1827919,BHS_68_2013.txt.88,"free trade, then implement policies that inevitably bring",BHS,2013
109996,LBY_30_1975.txt.95,"You will be the losers if you have chosen to go with the logic of Zionism to the end, and the end of Zionism is inevitable.",LBY,1975
1452808,KGZ_61_2006.txt.120,poverty.,KGZ,2006
1510031,LCA_62_2007.txt.117,much financial and technical assistance to our country,LCA,2007
858890,LKA_51_1996.txt.302,"and environmental policies are essential for all societies,",LKA,1996
1961628,GEO_71_2016.txt.108,"Thanks to Georgia’s strategic location, our ports, roads and transport networks will be an important part of the ambitious and transformative Silk Road Development Plan connecting Europe to Asia.",GEO,2016
378233,MAR_38_1983.txt.13,"Each of us rose above the conflicts and disputes of the past, and with God's help we reached the conclusions of the Fez Conference.",MAR,1983
1069804,MUS_54_1999.txt.341,countries and vulnerable small island developing States in,MUS,1999
431153,MUS_40_1985.txt.66,"In the light of the declarations of all involved that their aim is peace and stability, it would seem that the objectives should be readily attainable.",MUS,1985
1775991,CYP_67_2012.txt.207,"In looking beyond 2015, we need",CYP,2012
1614038,ISR_64_2009.txt.268,thousands of cellular phone calls urging them to,ISR,2009
1572372,NZL_63_2008.txt.27,mechanism for us all to respond.,NZL,2008
600037,SLE_47_1992.txt.248,The National,SLE,1992
538064,CHN_46_1991.txt.69,"In addition, China has always stood for the early conclusion of a convention banning chemical weapons and for greater effectiveness for the Convention on the Prohibition of Biological Weapons.",CHN,1991
424498,EGY_40_1985.txt.61,This situation gives rise to a state of unrest and tension which could be used as a pretext for large-scale foreign intervention - a development that could lead to a widening of the sphere of conflict and an escalation of fighting and destruction.,EGY,1985
1501355,GTM_62_2007.txt.261,reorientation of the Organization that will enhance its,GTM,2007
670301,SUR_48_1993.txt.8,for the Organization.,SUR,1993
962466,BHR_53_1998.txt.41,This must be done in order to radically,BHR,1998
1571281,NLD_63_2008.txt.109,partnership works.,NLD,2008
1499671,GIN_62_2007.txt.263,"Of course, the",GIN,2007
1041671,EGY_54_1999.txt.114,have begun to blow in various parts of the world.,EGY,1999
246837,TCD_35_1980.txt.134,"It was within that framework that, at the OAU meetings in June and July, at Freetown, the Chad delegation gave its full support to the resolution dealing with the Chad crisis with a view to finding an African solution.",TCD,1980
1588291,WSM_63_2008.txt.153," Troubled spots around the world are on the rise,",WSM,2008
1234281,IDN_57_2002.txt.226,much criticized for its preoccupation with consultations,IDN,2002
1462167,NAM_61_2006.txt.90, Namibia attaches importance to the global,NAM,2006
1989672,ALB_73_2018.txt.75,It is quite clear that the consequences of climate change are moving faster than we are.,ALB,2018
273616,THA_36_1981.txt.75,"The Conference emphasized that Kampuchea, like all other countries, has the right to be independent and sovereign, free from any external threat or armed intervention, free to pursue its own development and a better life for its people in an environment of peace, stability and full respect for human rights.",THA,1981
333724,NLD_37_1982.txt.151,no alternative but endless war.,NLD,1982
406241,LBY_39_1984.txt.10,My delegation takes pleasure in congratulating Brunei Darussalam upon its accession to independence.,LBY,1984
555860,AUT_47_1992.txt.62,"the increasing political importance of regional arrangements, the",AUT,1992
646986,LBN_48_1993.txt.252,The Kingdom of Saudi Arabia,LBN,1993
